"1";"Henry IV";;;;"ACT I"
"7368";"Henry VI Part 2";"8";"2.4.37";"DUCHESS";"And bid me be advised how I tread."
"7369";"Henry VI Part 2";"8";"2.4.38";"DUCHESS";"Ah, Humphrey, can I bear this shameful yoke?"
"7370";"Henry VI Part 2";"8";"2.4.39";"DUCHESS";"Trow'st thou that e'er I'll look upon the world,"
"7371";"Henry VI Part 2";"8";"2.4.40";"DUCHESS";"Or count them happy that enjoy the sun?"
"7372";"Henry VI Part 2";"8";"2.4.41";"DUCHESS";"No; dark shall be my light and night my day;"
"7373";"Henry VI Part 2";"8";"2.4.42";"DUCHESS";"To think upon my pomp shall be my hell."
"7374";"Henry VI Part 2";"8";"2.4.43";"DUCHESS";"Sometime I'll say, I am Duke Humphrey's wife,"
"7375";"Henry VI Part 2";"8";"2.4.44";"DUCHESS";"And he a prince and ruler of the land:"
"7376";"Henry VI Part 2";"8";"2.4.45";"DUCHESS";"Yet so he ruled and such a prince he was"
"7377";"Henry VI Part 2";"8";"2.4.46";"DUCHESS";"As he stood by whilst I, his forlorn duchess,"
"7378";"Henry VI Part 2";"8";"2.4.47";"DUCHESS";"Was made a wonder and a pointing-stock"
"7379";"Henry VI Part 2";"8";"2.4.48";"DUCHESS";"To every idle rascal follower."
"7380";"Henry VI Part 2";"8";"2.4.49";"DUCHESS";"But be thou mild and blush not at my shame,"
"7381";"Henry VI Part 2";"8";"2.4.50";"DUCHESS";"Nor stir at nothing till the axe of death"
"7382";"Henry VI Part 2";"8";"2.4.51";"DUCHESS";"Hang over thee, as, sure, it shortly will;"
"7383";"Henry VI Part 2";"8";"2.4.52";"DUCHESS";"For Suffolk, he that can do all in all"
"7384";"Henry VI Part 2";"8";"2.4.53";"DUCHESS";"With her that hateth thee and hates us all,"
"7385";"Henry VI Part 2";"8";"2.4.54";"DUCHESS";"And York and impious Beaufort, that false priest,"
"7386";"Henry VI Part 2";"8";"2.4.55";"DUCHESS";"Have all limed bushes to betray thy wings,"
"7387";"Henry VI Part 2";"8";"2.4.56";"DUCHESS";"And, fly thou how thou canst, they'll tangle thee:"
"7388";"Henry VI Part 2";"8";"2.4.57";"DUCHESS";"But fear not thou, until thy foot be snared,"
"7389";"Henry VI Part 2";"8";"2.4.58";"DUCHESS";"Nor never seek prevention of thy foes."
"7390";"Henry VI Part 2";"9";"2.4.59";"GLOUCESTER";"Ah, Nell, forbear! thou aimest all awry;"
"7391";"Henry VI Part 2";"9";"2.4.60";"GLOUCESTER";"I must offend before I be attainted;"
"7392";"Henry VI Part 2";"9";"2.4.61";"GLOUCESTER";"And had I twenty times so many foes,"
"7393";"Henry VI Part 2";"9";"2.4.62";"GLOUCESTER";"And each of them had twenty times their power,"
"7394";"Henry VI Part 2";"9";"2.4.63";"GLOUCESTER";"All these could not procure me any scathe,"
"7395";"Henry VI Part 2";"9";"2.4.64";"GLOUCESTER";"So long as I am loyal, true and crimeless."
"7396";"Henry VI Part 2";"9";"2.4.65";"GLOUCESTER";"Wouldst have me rescue thee from this reproach?"
"7397";"Henry VI Part 2";"9";"2.4.66";"GLOUCESTER";"Why, yet thy scandal were not wiped away"
"7398";"Henry VI Part 2";"9";"2.4.67";"GLOUCESTER";"But I in danger for the breach of law."
"7399";"Henry VI Part 2";"9";"2.4.68";"GLOUCESTER";"Thy greatest help is quiet, gentle Nell:"
"7400";"Henry VI Part 2";"9";"2.4.69";"GLOUCESTER";"I pray thee, sort thy heart to patience;"
"7401";"Henry VI Part 2";"9";"2.4.70";"GLOUCESTER";"These few days' wonder will be quickly worn."
"7402";"Henry VI Part 2";"9";;"GLOUCESTER";"Enter a Herald"
"7403";"Henry VI Part 2";"10";"2.4.71";"Herald";"I summon your grace to his majesty's parliament,"
"7404";"Henry VI Part 2";"10";"2.4.72";"Herald";"Holden at Bury the first of this next month."
"7405";"Henry VI Part 2";"11";"2.4.73";"GLOUCESTER";"And my consent ne'er ask'd herein before!"
"7406";"Henry VI Part 2";"11";"2.4.74";"GLOUCESTER";"This is close dealing. Well, I will be there."
"7407";"Henry VI Part 2";"11";;"GLOUCESTER";"Exit Herald"
"7408";"Henry VI Part 2";"11";"2.4.75";"GLOUCESTER";"My Nell, I take my leave: and, master sheriff,"
"7409";"Henry VI Part 2";"11";"2.4.76";"GLOUCESTER";"Let not her penance exceed the king's commission."
"7410";"Henry VI Part 2";"12";"2.4.77";"Sheriff";"An't please your grace, here my commission stays,"
"7411";"Henry VI Part 2";"12";"2.4.78";"Sheriff";"And Sir John Stanley is appointed now"
"7412";"Henry VI Part 2";"12";"2.4.79";"Sheriff";"To take her with him to the Isle of Man."
"7413";"Henry VI Part 2";"13";"2.4.80";"GLOUCESTER";"Must you, Sir John, protect my lady here?"
"7414";"Henry VI Part 2";"14";"2.4.81";"STANLEY";"So am I given in charge, may't please your grace."
"7415";"Henry VI Part 2";"15";"2.4.82";"GLOUCESTER";"Entreat her not the worse in that I pray"
"7416";"Henry VI Part 2";"15";"2.4.83";"GLOUCESTER";"You use her well: the world may laugh again;"
"7417";"Henry VI Part 2";"15";"2.4.84";"GLOUCESTER";"And I may live to do you kindness if"
"7418";"Henry VI Part 2";"15";"2.4.85";"GLOUCESTER";"You do it her: and so, Sir John, farewell!"
"7419";"Henry VI Part 2";"16";"2.4.86";"DUCHESS";"What, gone, my lord, and bid me not farewell!"
"7420";"Henry VI Part 2";"17";"2.4.87";"GLOUCESTER";"Witness my tears, I cannot stay to speak."
"7421";"Henry VI Part 2";"17";;"GLOUCESTER";"Exeunt GLOUCESTER and Servingmen"
"7422";"Henry VI Part 2";"18";"2.4.88";"DUCHESS";"Art thou gone too? all comfort go with thee!"
"7423";"Henry VI Part 2";"18";"2.4.89";"DUCHESS";"For none abides with me: my joy is death;"
"7424";"Henry VI Part 2";"18";"2.4.90";"DUCHESS";"Death, at whose name I oft have been afear'd,"
"7425";"Henry VI Part 2";"18";"2.4.91";"DUCHESS";"Because I wish'd this world's eternity."
"7426";"Henry VI Part 2";"18";"2.4.92";"DUCHESS";"Stanley, I prithee, go, and take me hence;"
"7427";"Henry VI Part 2";"18";"2.4.93";"DUCHESS";"I care not whither, for I beg no favour,"
"7428";"Henry VI Part 2";"18";"2.4.94";"DUCHESS";"Only convey me where thou art commanded."
"7429";"Henry VI Part 2";"19";"2.4.95";"STANLEY";"Why, madam, that is to the Isle of Man;"
"7430";"Henry VI Part 2";"19";"2.4.96";"STANLEY";"There to be used according to your state."
"7431";"Henry VI Part 2";"20";"2.4.97";"DUCHESS";"That's bad enough, for I am but reproach:"
"7432";"Henry VI Part 2";"20";"2.4.98";"DUCHESS";"And shall I then be used reproachfully?"
"7433";"Henry VI Part 2";"21";"2.4.99";"STANLEY";"Like to a duchess, and Duke Humphrey's lady;"
"7434";"Henry VI Part 2";"21";"2.4.100";"STANLEY";"According to that state you shall be used."
"7435";"Henry VI Part 2";"22";"2.4.101";"DUCHESS";"Sheriff, farewell, and better than I fare,"
"7436";"Henry VI Part 2";"22";"2.4.102";"DUCHESS";"Although thou hast been conduct of my shame."
"7437";"Henry VI Part 2";"23";"2.4.103";"Sheriff";"It is my office; and, madam, pardon me."
"7438";"Henry VI Part 2";"24";"2.4.104";"DUCHESS";"Ay, ay, farewell; thy office is discharged."
"7439";"Henry VI Part 2";"24";"2.4.105";"DUCHESS";"Come, Stanley, shall we go?"
"7440";"Henry VI Part 2";"25";"2.4.106";"STANLEY";"Madam, your penance done, throw off this sheet,"
"7441";"Henry VI Part 2";"25";"2.4.107";"STANLEY";"And go we to attire you for our journey."
"7442";"Henry VI Part 2";"26";"2.4.108";"DUCHESS";"My shame will not be shifted with my sheet:"
"7443";"Henry VI Part 2";"26";"2.4.109";"DUCHESS";"No, it will hang upon my richest robes"
"7444";"Henry VI Part 2";"26";"2.4.110";"DUCHESS";"And show itself, attire me how I can."
"7445";"Henry VI Part 2";"26";"2.4.111";"DUCHESS";"Go, lead the way; I long to see my prison."
"7446";"Henry VI Part 2";"26";;"DUCHESS";"Exeunt"
"7447";"Henry VI Part 2";"26";;"DUCHESS";"ACT III"
"7448";"Henry VI Part 2";"26";;"DUCHESS";"SCENE I. The Abbey at Bury St. Edmund's."
"7449";"Henry VI Part 2";"26";;"DUCHESS";"Sound a sennet. Enter KING HENRY VI, QUEEN  MARGARET, CARDINAL, SUFFOLK, YORK, BUCKINGHAM, SALISBURY and WARWICK to the Parliament"
"7450";"Henry VI Part 2";"1";"3.1.1";"KING HENRY VI";"I muse my Lord of Gloucester is not come:"
"7451";"Henry VI Part 2";"1";"3.1.2";"KING HENRY VI";"'Tis not his wont to be the hindmost man,"
"7452";"Henry VI Part 2";"1";"3.1.3";"KING HENRY VI";"Whate'er occasion keeps him from us now."
"7453";"Henry VI Part 2";"2";"3.1.4";"QUEEN MARGARET";"Can you not see? or will ye not observe"
"7454";"Henry VI Part 2";"2";"3.1.5";"QUEEN MARGARET";"The strangeness of his alter'd countenance?"
"7455";"Henry VI Part 2";"2";"3.1.6";"QUEEN MARGARET";"With what a majesty he bears himself,"
"7456";"Henry VI Part 2";"2";"3.1.7";"QUEEN MARGARET";"How insolent of late he is become,"
"7457";"Henry VI Part 2";"2";"3.1.8";"QUEEN MARGARET";"How proud, how peremptory, and unlike himself?"
"7458";"Henry VI Part 2";"2";"3.1.9";"QUEEN MARGARET";"We know the time since he was mild and affable,"
"7459";"Henry VI Part 2";"2";"3.1.10";"QUEEN MARGARET";"And if we did but glance a far-off look,"
"7460";"Henry VI Part 2";"2";"3.1.11";"QUEEN MARGARET";"Immediately he was upon his knee,"
"7461";"Henry VI Part 2";"2";"3.1.12";"QUEEN MARGARET";"That all the court admired him for submission:"
"7462";"Henry VI Part 2";"2";"3.1.13";"QUEEN MARGARET";"But meet him now, and, be it in the morn,"
"7463";"Henry VI Part 2";"2";"3.1.14";"QUEEN MARGARET";"When every one will give the time of day,"
"7464";"Henry VI Part 2";"2";"3.1.15";"QUEEN MARGARET";"He knits his brow and shows an angry eye,"
"7465";"Henry VI Part 2";"2";"3.1.16";"QUEEN MARGARET";"And passeth by with stiff unbowed knee,"
"7466";"Henry VI Part 2";"2";"3.1.17";"QUEEN MARGARET";"Disdaining duty that to us belongs."
"7467";"Henry VI Part 2";"2";"3.1.18";"QUEEN MARGARET";"Small curs are not regarded when they grin;"
"7468";"Henry VI Part 2";"2";"3.1.19";"QUEEN MARGARET";"But great men tremble when the lion roars;"
"7469";"Henry VI Part 2";"2";"3.1.20";"QUEEN MARGARET";"And Humphrey is no little man in England."
"7470";"Henry VI Part 2";"2";"3.1.21";"QUEEN MARGARET";"First note that he is near you in descent,"
"7471";"Henry VI Part 2";"2";"3.1.22";"QUEEN MARGARET";"And should you fall, he as the next will mount."
"7472";"Henry VI Part 2";"2";"3.1.23";"QUEEN MARGARET";"Me seemeth then it is no policy,"
"7473";"Henry VI Part 2";"2";"3.1.24";"QUEEN MARGARET";"Respecting what a rancorous mind he bears"
"7474";"Henry VI Part 2";"2";"3.1.25";"QUEEN MARGARET";"And his advantage following your decease,"
"7475";"Henry VI Part 2";"2";"3.1.26";"QUEEN MARGARET";"That he should come about your royal person"
"7476";"Henry VI Part 2";"2";"3.1.27";"QUEEN MARGARET";"Or be admitted to your highness' council."
"7477";"Henry VI Part 2";"2";"3.1.28";"QUEEN MARGARET";"By flattery hath he won the commons' hearts,"
"7478";"Henry VI Part 2";"2";"3.1.29";"QUEEN MARGARET";"And when he please to make commotion,"
"7479";"Henry VI Part 2";"2";"3.1.30";"QUEEN MARGARET";"'Tis to be fear'd they all will follow him."
"7480";"Henry VI Part 2";"2";"3.1.31";"QUEEN MARGARET";"Now 'tis the spring, and weeds are shallow-rooted;"
"7481";"Henry VI Part 2";"2";"3.1.32";"QUEEN MARGARET";"Suffer them now, and they'll o'ergrow the garden"
"7482";"Henry VI Part 2";"2";"3.1.33";"QUEEN MARGARET";"And choke the herbs for want of husbandry."
"7483";"Henry VI Part 2";"2";"3.1.34";"QUEEN MARGARET";"The reverent care I bear unto my lord"
"7484";"Henry VI Part 2";"2";"3.1.35";"QUEEN MARGARET";"Made me collect these dangers in the duke."
"7485";"Henry VI Part 2";"2";"3.1.36";"QUEEN MARGARET";"If it be fond, call it a woman's fear;"
"7486";"Henry VI Part 2";"2";"3.1.37";"QUEEN MARGARET";"Which fear if better reasons can supplant,"
"7487";"Henry VI Part 2";"2";"3.1.38";"QUEEN MARGARET";"I will subscribe and say I wrong'd the duke."
"7488";"Henry VI Part 2";"2";"3.1.39";"QUEEN MARGARET";"My Lord of Suffolk, Buckingham, and York,"
"7489";"Henry VI Part 2";"2";"3.1.40";"QUEEN MARGARET";"Reprove my allegation, if you can;"
"7490";"Henry VI Part 2";"2";"3.1.41";"QUEEN MARGARET";"Or else conclude my words effectual."
"7491";"Henry VI Part 2";"3";"3.1.42";"SUFFOLK";"Well hath your highness seen into this duke;"
"7492";"Henry VI Part 2";"3";"3.1.43";"SUFFOLK";"And, had I first been put to speak my mind,"
"7493";"Henry VI Part 2";"3";"3.1.44";"SUFFOLK";"I think I should have told your grace's tale."
"7494";"Henry VI Part 2";"3";"3.1.45";"SUFFOLK";"The duchess, by his subornation,"
"7495";"Henry VI Part 2";"3";"3.1.46";"SUFFOLK";"Upon my life, began her devilish practises:"
"7496";"Henry VI Part 2";"3";"3.1.47";"SUFFOLK";"Or, if he were not privy to those faults,"
"7497";"Henry VI Part 2";"3";"3.1.48";"SUFFOLK";"Yet, by reputing of his high descent,"
"7498";"Henry VI Part 2";"3";"3.1.49";"SUFFOLK";"As next the king he was successive heir,"
"7499";"Henry VI Part 2";"3";"3.1.50";"SUFFOLK";"And such high vaunts of his nobility,"
"7500";"Henry VI Part 2";"3";"3.1.51";"SUFFOLK";"Did instigate the bedlam brain-sick duchess"
"7501";"Henry VI Part 2";"3";"3.1.52";"SUFFOLK";"By wicked means to frame our sovereign's fall."
"7502";"Henry VI Part 2";"3";"3.1.53";"SUFFOLK";"Smooth runs the water where the brook is deep;"
"7503";"Henry VI Part 2";"3";"3.1.54";"SUFFOLK";"And in his simple show he harbours treason."
"7504";"Henry VI Part 2";"3";"3.1.55";"SUFFOLK";"The fox barks not when he would steal the lamb."
"7505";"Henry VI Part 2";"3";"3.1.56";"SUFFOLK";"No, no, my sovereign; Gloucester is a man"
"7506";"Henry VI Part 2";"3";"3.1.57";"SUFFOLK";"Unsounded yet and full of deep deceit."
"7507";"Henry VI Part 2";"4";"3.1.58";"CARDINAL";"Did he not, contrary to form of law,"
"7508";"Henry VI Part 2";"4";"3.1.59";"CARDINAL";"Devise strange deaths for small offences done?"
"7509";"Henry VI Part 2";"5";"3.1.60";"YORK";"And did he not, in his protectorship,"
"7510";"Henry VI Part 2";"5";"3.1.61";"YORK";"Levy great sums of money through the realm"
"7511";"Henry VI Part 2";"5";"3.1.62";"YORK";"For soldiers' pay in France, and never sent it?"
"7512";"Henry VI Part 2";"5";"3.1.63";"YORK";"By means whereof the towns each day revolted."
"7513";"Henry VI Part 2";"6";"3.1.64";"BUCKINGHAM";"Tut, these are petty faults to faults unknown."
"7514";"Henry VI Part 2";"6";"3.1.65";"BUCKINGHAM";"Which time will bring to light in smooth"
"7515";"Henry VI Part 2";"6";"3.1.66";"BUCKINGHAM";"Duke Humphrey."
"7516";"Henry VI Part 2";"7";"3.1.67";"KING HENRY VI";"My lords, at once: the care you have of us,"
"7517";"Henry VI Part 2";"7";"3.1.68";"KING HENRY VI";"To mow down thorns that would annoy our foot,"
"7518";"Henry VI Part 2";"7";"3.1.69";"KING HENRY VI";"Is worthy praise: but, shall I speak my conscience,"
"7519";"Henry VI Part 2";"7";"3.1.70";"KING HENRY VI";"Our kinsman Gloucester is as innocent"
"7520";"Henry VI Part 2";"7";"3.1.71";"KING HENRY VI";"From meaning treason to our royal person"
"7521";"Henry VI Part 2";"7";"3.1.72";"KING HENRY VI";"As is the sucking lamb or harmless dove:"
"7522";"Henry VI Part 2";"7";"3.1.73";"KING HENRY VI";"The duke is virtuous, mild and too well given"
"7523";"Henry VI Part 2";"7";"3.1.74";"KING HENRY VI";"To dream on evil or to work my downfall."
"7524";"Henry VI Part 2";"8";"3.1.75";"QUEEN MARGARET";"Ah, what's more dangerous than this fond affiance!"
"7525";"Henry VI Part 2";"8";"3.1.76";"QUEEN MARGARET";"Seems he a dove? his feathers are but borrowed,"
"7526";"Henry VI Part 2";"8";"3.1.77";"QUEEN MARGARET";"For he's disposed as the hateful raven:"
"7527";"Henry VI Part 2";"8";"3.1.78";"QUEEN MARGARET";"Is he a lamb? his skin is surely lent him,"
"7528";"Henry VI Part 2";"8";"3.1.79";"QUEEN MARGARET";"For he's inclined as is the ravenous wolf."
"7529";"Henry VI Part 2";"8";"3.1.80";"QUEEN MARGARET";"Who cannot steal a shape that means deceit?"
"7530";"Henry VI Part 2";"8";"3.1.81";"QUEEN MARGARET";"Take heed, my lord; the welfare of us all"
"7531";"Henry VI Part 2";"8";"3.1.82";"QUEEN MARGARET";"Hangs on the cutting short that fraudful man."
"7532";"Henry VI Part 2";"8";;"QUEEN MARGARET";"Enter SOMERSET"
"7533";"Henry VI Part 2";"9";"3.1.83";"SOMERSET";"All health unto my gracious sovereign!"
"7534";"Henry VI Part 2";"10";"3.1.84";"KING HENRY VI";"Welcome, Lord Somerset. What news from France?"
"7535";"Henry VI Part 2";"11";"3.1.85";"SOMERSET";"That all your interest in those territories"
"7536";"Henry VI Part 2";"11";"3.1.86";"SOMERSET";"Is utterly bereft you; all is lost."
"7537";"Henry VI Part 2";"12";"3.1.87";"KING HENRY VI";"Cold news, Lord Somerset: but God's will be done!"
"7538";"Henry VI Part 2";"13";"3.1.88";"YORK";"[Aside]  Cold news for me; for I had hope of France"
"7539";"Henry VI Part 2";"13";"3.1.89";"YORK";"As firmly as I hope for fertile England."
"7540";"Henry VI Part 2";"13";"3.1.90";"YORK";"Thus are my blossoms blasted in the bud"
"7541";"Henry VI Part 2";"13";"3.1.91";"YORK";"And caterpillars eat my leaves away;"
"7542";"Henry VI Part 2";"13";"3.1.92";"YORK";"But I will remedy this gear ere long,"
"7543";"Henry VI Part 2";"13";"3.1.93";"YORK";"Or sell my title for a glorious grave."
"7544";"Henry VI Part 2";"13";;"YORK";"Enter GLOUCESTER"
"7545";"Henry VI Part 2";"14";"3.1.94";"GLOUCESTER";"All happiness unto my lord the king!"
"7546";"Henry VI Part 2";"14";"3.1.95";"GLOUCESTER";"Pardon, my liege, that I have stay'd so long."
"7547";"Henry VI Part 2";"15";"3.1.96";"SUFFOLK";"Nay, Gloucester, know that thou art come too soon,"
"7548";"Henry VI Part 2";"15";"3.1.97";"SUFFOLK";"Unless thou wert more loyal than thou art:"
"7549";"Henry VI Part 2";"15";"3.1.98";"SUFFOLK";"I do arrest thee of high treason here."
"7550";"Henry VI Part 2";"16";"3.1.99";"GLOUCESTER";"Well, Suffolk, thou shalt not see me blush"
"7551";"Henry VI Part 2";"16";"3.1.100";"GLOUCESTER";"Nor change my countenance for this arrest:"
"7552";"Henry VI Part 2";"16";"3.1.101";"GLOUCESTER";"A heart unspotted is not easily daunted."
"7553";"Henry VI Part 2";"16";"3.1.102";"GLOUCESTER";"The purest spring is not so free from mud"
"7554";"Henry VI Part 2";"16";"3.1.103";"GLOUCESTER";"As I am clear from treason to my sovereign:"
"7555";"Henry VI Part 2";"16";"3.1.104";"GLOUCESTER";"Who can accuse me? wherein am I guilty?"
"7556";"Henry VI Part 2";"17";"3.1.105";"YORK";"'Tis thought, my lord, that you took bribes of France,"
"7557";"Henry VI Part 2";"17";"3.1.106";"YORK";"And, being protector, stayed the soldiers' pay;"
"7558";"Henry VI Part 2";"17";"3.1.107";"YORK";"By means whereof his highness hath lost France."
"7559";"Henry VI Part 2";"18";"3.1.108";"GLOUCESTER";"Is it but thought so? what are they that think it?"
"7560";"Henry VI Part 2";"18";"3.1.109";"GLOUCESTER";"I never robb'd the soldiers of their pay,"
"7561";"Henry VI Part 2";"18";"3.1.110";"GLOUCESTER";"Nor ever had one penny bribe from France."
"7562";"Henry VI Part 2";"18";"3.1.111";"GLOUCESTER";"So help me God, as I have watch'd the night,"
"7563";"Henry VI Part 2";"18";"3.1.112";"GLOUCESTER";"Ay, night by night, in studying good for England,"
"7564";"Henry VI Part 2";"18";"3.1.113";"GLOUCESTER";"That doit that e'er I wrested from the king,"
"7565";"Henry VI Part 2";"18";"3.1.114";"GLOUCESTER";"Or any groat I hoarded to my use,"
"7566";"Henry VI Part 2";"18";"3.1.115";"GLOUCESTER";"Be brought against me at my trial-day!"
"7567";"Henry VI Part 2";"18";"3.1.116";"GLOUCESTER";"No; many a pound of mine own proper store,"
"7568";"Henry VI Part 2";"18";"3.1.117";"GLOUCESTER";"Because I would not tax the needy commons,"
"7569";"Henry VI Part 2";"18";"3.1.118";"GLOUCESTER";"Have I disbursed to the garrisons,"
"7570";"Henry VI Part 2";"18";"3.1.119";"GLOUCESTER";"And never ask'd for restitution."
"7571";"Henry VI Part 2";"19";"3.1.120";"CARDINAL";"It serves you well, my lord, to say so much."
"7572";"Henry VI Part 2";"20";"3.1.121";"GLOUCESTER";"I say no more than truth, so help me God!"
"7573";"Henry VI Part 2";"21";"3.1.122";"YORK";"In your protectorship you did devise"
"7574";"Henry VI Part 2";"21";"3.1.123";"YORK";"Strange tortures for offenders never heard of,"
"7575";"Henry VI Part 2";"21";"3.1.124";"YORK";"That England was defamed by tyranny."
"7576";"Henry VI Part 2";"22";"3.1.125";"GLOUCESTER";"Why, 'tis well known that, whiles I was"
"7577";"Henry VI Part 2";"22";"3.1.126";"GLOUCESTER";"protector,"
"7578";"Henry VI Part 2";"22";"3.1.127";"GLOUCESTER";"Pity was all the fault that was in me;"
"7579";"Henry VI Part 2";"22";"3.1.128";"GLOUCESTER";"For I should melt at an offender's tears,"
"7580";"Henry VI Part 2";"22";"3.1.129";"GLOUCESTER";"And lowly words were ransom for their fault."
"7581";"Henry VI Part 2";"22";"3.1.130";"GLOUCESTER";"Unless it were a bloody murderer,"
"7582";"Henry VI Part 2";"22";"3.1.131";"GLOUCESTER";"Or foul felonious thief that fleeced poor passengers,"
"7583";"Henry VI Part 2";"22";"3.1.132";"GLOUCESTER";"I never gave them condign punishment:"
"7584";"Henry VI Part 2";"22";"3.1.133";"GLOUCESTER";"Murder indeed, that bloody sin, I tortured"
"7585";"Henry VI Part 2";"22";"3.1.134";"GLOUCESTER";"Above the felon or what trespass else."
"7586";"Henry VI Part 2";"23";"3.1.135";"SUFFOLK";"My lord, these faults are easy, quickly answered:"
"7587";"Henry VI Part 2";"23";"3.1.136";"SUFFOLK";"But mightier crimes are laid unto your charge,"
"7588";"Henry VI Part 2";"23";"3.1.137";"SUFFOLK";"Whereof you cannot easily purge yourself."
"7589";"Henry VI Part 2";"23";"3.1.138";"SUFFOLK";"I do arrest you in his highness' name;"
"7590";"Henry VI Part 2";"23";"3.1.139";"SUFFOLK";"And here commit you to my lord cardinal"
"7591";"Henry VI Part 2";"23";"3.1.140";"SUFFOLK";"To keep, until your further time of trial."
"7592";"Henry VI Part 2";"24";"3.1.141";"KING HENRY VI";"My lord of Gloucester, 'tis my special hope"
"7593";"Henry VI Part 2";"24";"3.1.142";"KING HENRY VI";"That you will clear yourself from all suspect:"
"7594";"Henry VI Part 2";"24";"3.1.143";"KING HENRY VI";"My conscience tells me you are innocent."
"7595";"Henry VI Part 2";"25";"3.1.144";"GLOUCESTER";"Ah, gracious lord, these days are dangerous:"
"7596";"Henry VI Part 2";"25";"3.1.145";"GLOUCESTER";"Virtue is choked with foul ambition"
"7597";"Henry VI Part 2";"25";"3.1.146";"GLOUCESTER";"And charity chased hence by rancour's hand;"
"7598";"Henry VI Part 2";"25";"3.1.147";"GLOUCESTER";"Foul subornation is predominant"
"7599";"Henry VI Part 2";"25";"3.1.148";"GLOUCESTER";"And equity exiled your highness' land."
"7600";"Henry VI Part 2";"25";"3.1.149";"GLOUCESTER";"I know their complot is to have my life,"
"7601";"Henry VI Part 2";"25";"3.1.150";"GLOUCESTER";"And if my death might make this island happy,"
"7602";"Henry VI Part 2";"25";"3.1.151";"GLOUCESTER";"And prove the period of their tyranny,"
"7603";"Henry VI Part 2";"25";"3.1.152";"GLOUCESTER";"I would expend it with all willingness:"
"7604";"Henry VI Part 2";"25";"3.1.153";"GLOUCESTER";"But mine is made the prologue to their play;"
"7605";"Henry VI Part 2";"25";"3.1.154";"GLOUCESTER";"For thousands more, that yet suspect no peril,"
"7606";"Henry VI Part 2";"25";"3.1.155";"GLOUCESTER";"Will not conclude their plotted tragedy."
"7607";"Henry VI Part 2";"25";"3.1.156";"GLOUCESTER";"Beaufort's red sparkling eyes blab his heart's malice,"
"7608";"Henry VI Part 2";"25";"3.1.157";"GLOUCESTER";"And Suffolk's cloudy brow his stormy hate;"
"7609";"Henry VI Part 2";"25";"3.1.158";"GLOUCESTER";"Sharp Buckingham unburthens with his tongue"
"7610";"Henry VI Part 2";"25";"3.1.159";"GLOUCESTER";"The envious load that lies upon his heart;"
"7611";"Henry VI Part 2";"25";"3.1.160";"GLOUCESTER";"And dogged York, that reaches at the moon,"
"7612";"Henry VI Part 2";"25";"3.1.161";"GLOUCESTER";"Whose overweening arm I have pluck'd back,"
"7613";"Henry VI Part 2";"25";"3.1.162";"GLOUCESTER";"By false accuse doth level at my life:"
"7614";"Henry VI Part 2";"25";"3.1.163";"GLOUCESTER";"And you, my sovereign lady, with the rest,"
"7615";"Henry VI Part 2";"25";"3.1.164";"GLOUCESTER";"Causeless have laid disgraces on my head,"
"7616";"Henry VI Part 2";"25";"3.1.165";"GLOUCESTER";"And with your best endeavour have stirr'd up"
"7617";"Henry VI Part 2";"25";"3.1.166";"GLOUCESTER";"My liefest liege to be mine enemy:"
"7618";"Henry VI Part 2";"25";"3.1.167";"GLOUCESTER";"Ay, all you have laid your heads together--"
"7619";"Henry VI Part 2";"25";"3.1.168";"GLOUCESTER";"Myself had notice of your conventicles--"
"7620";"Henry VI Part 2";"25";"3.1.169";"GLOUCESTER";"And all to make away my guiltless life."
"7621";"Henry VI Part 2";"25";"3.1.170";"GLOUCESTER";"I shall not want false witness to condemn me,"
"7622";"Henry VI Part 2";"25";"3.1.171";"GLOUCESTER";"Nor store of treasons to augment my guilt;"
"7623";"Henry VI Part 2";"25";"3.1.172";"GLOUCESTER";"The ancient proverb will be well effected:"
"7624";"Henry VI Part 2";"25";"3.1.173";"GLOUCESTER";"'A staff is quickly found to beat a dog.'"
"7625";"Henry VI Part 2";"26";"3.1.174";"CARDINAL";"My liege, his railing is intolerable:"
"7626";"Henry VI Part 2";"26";"3.1.175";"CARDINAL";"If those that care to keep your royal person"
"7627";"Henry VI Part 2";"26";"3.1.176";"CARDINAL";"From treason's secret knife and traitors' rage"
"7628";"Henry VI Part 2";"26";"3.1.177";"CARDINAL";"Be thus upbraided, chid and rated at,"
"7629";"Henry VI Part 2";"26";"3.1.178";"CARDINAL";"And the offender granted scope of speech,"
"7630";"Henry VI Part 2";"26";"3.1.179";"CARDINAL";"'Twill make them cool in zeal unto your grace."
"7631";"Henry VI Part 2";"27";"3.1.180";"SUFFOLK";"Hath he not twit our sovereign lady here"
"7632";"Henry VI Part 2";"27";"3.1.181";"SUFFOLK";"With ignominious words, though clerkly couch'd,"
"7633";"Henry VI Part 2";"27";"3.1.182";"SUFFOLK";"As if she had suborned some to swear"
"7634";"Henry VI Part 2";"27";"3.1.183";"SUFFOLK";"False allegations to o'erthrow his state?"
"7635";"Henry VI Part 2";"28";"3.1.184";"QUEEN MARGARET";"But I can give the loser leave to chide."
"7636";"Henry VI Part 2";"29";"3.1.185";"GLOUCESTER";"Far truer spoke than meant: I lose, indeed;"
"7637";"Henry VI Part 2";"29";"3.1.186";"GLOUCESTER";"Beshrew the winners, for they play'd me false!"
