"1";"Henry IV";;;;"ACT I"
"5158";"Henry VI Part 1";"38";"4.1.174";"KING HENRY VI";"To be presented, by your victories,"
"5159";"Henry VI Part 1";"38";"4.1.175";"KING HENRY VI";"With Charles, Alencon and that traitorous rout."
"5160";"Henry VI Part 1";"38";;"KING HENRY VI";"Flourish. Exeunt all but YORK, WARWICK, EXETER and VERNON"
"5161";"Henry VI Part 1";"39";"4.1.176";"WARWICK";"My Lord of York, I promise you, the king"
"5162";"Henry VI Part 1";"39";"4.1.177";"WARWICK";"Prettily, methought, did play the orator."
"5163";"Henry VI Part 1";"40";"4.1.178";"YORK";"And so he did; but yet I like it not,"
"5164";"Henry VI Part 1";"40";"4.1.179";"YORK";"In that he wears the badge of Somerset."
"5165";"Henry VI Part 1";"41";"4.1.180";"WARWICK";"Tush, that was but his fancy, blame him not;"
"5166";"Henry VI Part 1";"41";"4.1.181";"WARWICK";"I dare presume, sweet prince, he thought no harm."
"5167";"Henry VI Part 1";"42";"4.1.182";"YORK";"An if I wist he did,--but let it rest;"
"5168";"Henry VI Part 1";"42";"4.1.183";"YORK";"Other affairs must now be managed."
"5169";"Henry VI Part 1";"42";;"YORK";"Exeunt all but EXETER"
"5170";"Henry VI Part 1";"43";"4.1.184";"EXETER";"Well didst thou, Richard, to suppress thy voice;"
"5171";"Henry VI Part 1";"43";"4.1.185";"EXETER";"For, had the passions of thy heart burst out,"
"5172";"Henry VI Part 1";"43";"4.1.186";"EXETER";"I fear we should have seen decipher'd there"
"5173";"Henry VI Part 1";"43";"4.1.187";"EXETER";"More rancorous spite, more furious raging broils,"
"5174";"Henry VI Part 1";"43";"4.1.188";"EXETER";"Than yet can be imagined or supposed."
"5175";"Henry VI Part 1";"43";"4.1.189";"EXETER";"But howsoe'er, no simple man that sees"
"5176";"Henry VI Part 1";"43";"4.1.190";"EXETER";"This jarring discord of nobility,"
"5177";"Henry VI Part 1";"43";"4.1.191";"EXETER";"This shouldering of each other in the court,"
"5178";"Henry VI Part 1";"43";"4.1.192";"EXETER";"This factious bandying of their favourites,"
"5179";"Henry VI Part 1";"43";"4.1.193";"EXETER";"But that it doth presage some ill event."
"5180";"Henry VI Part 1";"43";"4.1.194";"EXETER";"'Tis much when sceptres are in children's hands;"
"5181";"Henry VI Part 1";"43";"4.1.195";"EXETER";"But more when envy breeds unkind division;"
"5182";"Henry VI Part 1";"43";"4.1.196";"EXETER";"There comes the rain, there begins confusion."
"5183";"Henry VI Part 1";"43";;"EXETER";"Exit"
"5184";"Henry VI Part 1";"43";;"EXETER";"SCENE II. Before Bourdeaux."
"5185";"Henry VI Part 1";"43";;"EXETER";"Enter TALBOT, with trump and drum"
"5186";"Henry VI Part 1";"1";"4.2.1";"TALBOT";"Go to the gates of Bourdeaux, trumpeter:"
"5187";"Henry VI Part 1";"1";"4.2.2";"TALBOT";"Summon their general unto the wall."
"5188";"Henry VI Part 1";"1";;"TALBOT";"Trumpet sounds. Enter General and others, aloft"
"5189";"Henry VI Part 1";"1";"4.2.3";"TALBOT";"English John Talbot, captains, calls you forth,"
"5190";"Henry VI Part 1";"1";"4.2.4";"TALBOT";"Servant in arms to Harry King of England;"
"5191";"Henry VI Part 1";"1";"4.2.5";"TALBOT";"And thus he would: Open your city gates;"
"5192";"Henry VI Part 1";"1";"4.2.6";"TALBOT";"Be humble to us; call my sovereign yours,"
"5193";"Henry VI Part 1";"1";"4.2.7";"TALBOT";"And do him homage as obedient subjects;"
"5194";"Henry VI Part 1";"1";"4.2.8";"TALBOT";"And I'll withdraw me and my bloody power:"
"5195";"Henry VI Part 1";"1";"4.2.9";"TALBOT";"But, if you frown upon this proffer'd peace,"
"5196";"Henry VI Part 1";"1";"4.2.10";"TALBOT";"You tempt the fury of my three attendants,"
"5197";"Henry VI Part 1";"1";"4.2.11";"TALBOT";"Lean famine, quartering steel, and climbing fire;"
"5198";"Henry VI Part 1";"1";"4.2.12";"TALBOT";"Who in a moment even with the earth"
"5199";"Henry VI Part 1";"1";"4.2.13";"TALBOT";"Shall lay your stately and air-braving towers,"
"5200";"Henry VI Part 1";"1";"4.2.14";"TALBOT";"If you forsake the offer of their love."
"5201";"Henry VI Part 1";"2";"4.2.15";"General";"Thou ominous and fearful owl of death,"
"5202";"Henry VI Part 1";"2";"4.2.16";"General";"Our nation's terror and their bloody scourge!"
"5203";"Henry VI Part 1";"2";"4.2.17";"General";"The period of thy tyranny approacheth."
"5204";"Henry VI Part 1";"2";"4.2.18";"General";"On us thou canst not enter but by death;"
"5205";"Henry VI Part 1";"2";"4.2.19";"General";"For, I protest, we are well fortified"
"5206";"Henry VI Part 1";"2";"4.2.20";"General";"And strong enough to issue out and fight:"
"5207";"Henry VI Part 1";"2";"4.2.21";"General";"If thou retire, the Dauphin, well appointed,"
"5208";"Henry VI Part 1";"2";"4.2.22";"General";"Stands with the snares of war to tangle thee:"
"5209";"Henry VI Part 1";"2";"4.2.23";"General";"On either hand thee there are squadrons pitch'd,"
"5210";"Henry VI Part 1";"2";"4.2.24";"General";"To wall thee from the liberty of flight;"
"5211";"Henry VI Part 1";"2";"4.2.25";"General";"And no way canst thou turn thee for redress,"
"5212";"Henry VI Part 1";"2";"4.2.26";"General";"But death doth front thee with apparent spoil"
"5213";"Henry VI Part 1";"2";"4.2.27";"General";"And pale destruction meets thee in the face."
"5214";"Henry VI Part 1";"2";"4.2.28";"General";"Ten thousand French have ta'en the sacrament"
"5215";"Henry VI Part 1";"2";"4.2.29";"General";"To rive their dangerous artillery"
"5216";"Henry VI Part 1";"2";"4.2.30";"General";"Upon no Christian soul but English Talbot."
"5217";"Henry VI Part 1";"2";"4.2.31";"General";"Lo, there thou stand'st, a breathing valiant man,"
"5218";"Henry VI Part 1";"2";"4.2.32";"General";"Of an invincible unconquer'd spirit!"
"5219";"Henry VI Part 1";"2";"4.2.33";"General";"This is the latest glory of thy praise"
"5220";"Henry VI Part 1";"2";"4.2.34";"General";"That I, thy enemy, due thee withal;"
"5221";"Henry VI Part 1";"2";"4.2.35";"General";"For ere the glass, that now begins to run,"
"5222";"Henry VI Part 1";"2";"4.2.36";"General";"Finish the process of his sandy hour,"
"5223";"Henry VI Part 1";"2";"4.2.37";"General";"These eyes, that see thee now well coloured,"
"5224";"Henry VI Part 1";"2";"4.2.38";"General";"Shall see thee wither'd, bloody, pale and dead."
"5225";"Henry VI Part 1";"2";;"General";"Drum afar off"
"5226";"Henry VI Part 1";"2";"4.2.39";"General";"Hark! hark! the Dauphin's drum, a warning bell,"
"5227";"Henry VI Part 1";"2";"4.2.40";"General";"Sings heavy music to thy timorous soul;"
"5228";"Henry VI Part 1";"2";"4.2.41";"General";"And mine shall ring thy dire departure out."
"5229";"Henry VI Part 1";"2";"4.2.41";"General";"Exeunt General,  and c"
"5230";"Henry VI Part 1";"3";"4.2.42";"TALBOT";"He fables not; I hear the enemy:"
"5231";"Henry VI Part 1";"3";"4.2.43";"TALBOT";"Out, some light horsemen, and peruse their wings."
"5232";"Henry VI Part 1";"3";"4.2.44";"TALBOT";"O, negligent and heedless discipline!"
"5233";"Henry VI Part 1";"3";"4.2.45";"TALBOT";"How are we park'd and bounded in a pale,"
"5234";"Henry VI Part 1";"3";"4.2.46";"TALBOT";"A little herd of England's timorous deer,"
"5235";"Henry VI Part 1";"3";"4.2.47";"TALBOT";"Mazed with a yelping kennel of French curs!"
"5236";"Henry VI Part 1";"3";"4.2.48";"TALBOT";"If we be English deer, be then in blood;"
"5237";"Henry VI Part 1";"3";"4.2.49";"TALBOT";"Not rascal-like, to fall down with a pinch,"
"5238";"Henry VI Part 1";"3";"4.2.50";"TALBOT";"But rather, moody-mad and desperate stags,"
"5239";"Henry VI Part 1";"3";"4.2.51";"TALBOT";"Turn on the bloody hounds with heads of steel"
"5240";"Henry VI Part 1";"3";"4.2.52";"TALBOT";"And make the cowards stand aloof at bay:"
"5241";"Henry VI Part 1";"3";"4.2.53";"TALBOT";"Sell every man his life as dear as mine,"
"5242";"Henry VI Part 1";"3";"4.2.54";"TALBOT";"And they shall find dear deer of us, my friends."
"5243";"Henry VI Part 1";"3";"4.2.55";"TALBOT";"God and Saint George, Talbot and England's right,"
"5244";"Henry VI Part 1";"3";"4.2.56";"TALBOT";"Prosper our colours in this dangerous fight!"
"5245";"Henry VI Part 1";"3";;"TALBOT";"Exeunt"
"5246";"Henry VI Part 1";"3";;"TALBOT";"SCENE III. Plains in Gascony."
"5247";"Henry VI Part 1";"3";;"TALBOT";"Enter a Messenger that meets YORK. Enter YORK with trumpet and many Soldiers"
"5248";"Henry VI Part 1";"1";"4.3.1";"YORK";"Are not the speedy scouts return'd again,"
"5249";"Henry VI Part 1";"1";"4.3.2";"YORK";"That dogg'd the mighty army of the Dauphin?"
"5250";"Henry VI Part 1";"2";"4.3.3";"Messenger";"They are return'd, my lord, and give it out"
"5251";"Henry VI Part 1";"2";"4.3.4";"Messenger";"That he is march'd to Bourdeaux with his power,"
"5252";"Henry VI Part 1";"2";"4.3.5";"Messenger";"To fight with Talbot: as he march'd along,"
"5253";"Henry VI Part 1";"2";"4.3.6";"Messenger";"By your espials were discovered"
"5254";"Henry VI Part 1";"2";"4.3.7";"Messenger";"Two mightier troops than that the Dauphin led,"
"5255";"Henry VI Part 1";"2";"4.3.8";"Messenger";"Which join'd with him and made their march for Bourdeaux."
"5256";"Henry VI Part 1";"3";"4.3.9";"YORK";"A plague upon that villain Somerset,"
"5257";"Henry VI Part 1";"3";"4.3.10";"YORK";"That thus delays my promised supply"
"5258";"Henry VI Part 1";"3";"4.3.11";"YORK";"Of horsemen, that were levied for this siege!"
"5259";"Henry VI Part 1";"3";"4.3.12";"YORK";"Renowned Talbot doth expect my aid,"
"5260";"Henry VI Part 1";"3";"4.3.13";"YORK";"And I am lowted by a traitor villain"
"5261";"Henry VI Part 1";"3";"4.3.14";"YORK";"And cannot help the noble chevalier:"
"5262";"Henry VI Part 1";"3";"4.3.15";"YORK";"God comfort him in this necessity!"
"5263";"Henry VI Part 1";"3";"4.3.16";"YORK";"If he miscarry, farewell wars in France."
"5264";"Henry VI Part 1";"3";;"YORK";"Enter Sir William LUCY"
"5265";"Henry VI Part 1";"4";"4.3.17";"LUCY";"Thou princely leader of our English strength,"
"5266";"Henry VI Part 1";"4";"4.3.18";"LUCY";"Never so needful on the earth of France,"
"5267";"Henry VI Part 1";"4";"4.3.19";"LUCY";"Spur to the rescue of the noble Talbot,"
"5268";"Henry VI Part 1";"4";"4.3.20";"LUCY";"Who now is girdled with a waist of iron"
"5269";"Henry VI Part 1";"4";"4.3.21";"LUCY";"And hemm'd about with grim destruction:"
"5270";"Henry VI Part 1";"4";"4.3.22";"LUCY";"To Bourdeaux, warlike duke! to Bourdeaux, York!"
"5271";"Henry VI Part 1";"4";"4.3.23";"LUCY";"Else, farewell Talbot, France, and England's honour."
"5272";"Henry VI Part 1";"5";"4.3.24";"YORK";"O God, that Somerset, who in proud heart"
"5273";"Henry VI Part 1";"5";"4.3.25";"YORK";"Doth stop my cornets, were in Talbot's place!"
"5274";"Henry VI Part 1";"5";"4.3.26";"YORK";"So should we save a valiant gentleman"
"5275";"Henry VI Part 1";"5";"4.3.27";"YORK";"By forfeiting a traitor and a coward."
"5276";"Henry VI Part 1";"5";"4.3.28";"YORK";"Mad ire and wrathful fury makes me weep,"
"5277";"Henry VI Part 1";"5";"4.3.29";"YORK";"That thus we die, while remiss traitors sleep."
"5278";"Henry VI Part 1";"6";"4.3.30";"LUCY";"O, send some succor to the distress'd lord!"
"5279";"Henry VI Part 1";"7";"4.3.31";"YORK";"He dies, we lose; I break my warlike word;"
"5280";"Henry VI Part 1";"7";"4.3.32";"YORK";"We mourn, France smiles; we lose, they daily get;"
"5281";"Henry VI Part 1";"7";"4.3.33";"YORK";"All 'long of this vile traitor Somerset."
"5282";"Henry VI Part 1";"8";"4.3.34";"LUCY";"Then God take mercy on brave Talbot's soul;"
"5283";"Henry VI Part 1";"8";"4.3.35";"LUCY";"And on his son young John, who two hours since"
"5284";"Henry VI Part 1";"8";"4.3.36";"LUCY";"I met in travel toward his warlike father!"
"5285";"Henry VI Part 1";"8";"4.3.37";"LUCY";"This seven years did not Talbot see his son;"
"5286";"Henry VI Part 1";"8";"4.3.38";"LUCY";"And now they meet where both their lives are done."
"5287";"Henry VI Part 1";"9";"4.3.39";"YORK";"Alas, what joy shall noble Talbot have"
"5288";"Henry VI Part 1";"9";"4.3.40";"YORK";"To bid his young son welcome to his grave?"
"5289";"Henry VI Part 1";"9";"4.3.41";"YORK";"Away! vexation almost stops my breath,"
"5290";"Henry VI Part 1";"9";"4.3.42";"YORK";"That sunder'd friends greet in the hour of death."
"5291";"Henry VI Part 1";"9";"4.3.43";"YORK";"Lucy, farewell; no more my fortune can,"
"5292";"Henry VI Part 1";"9";"4.3.44";"YORK";"But curse the cause I cannot aid the man."
"5293";"Henry VI Part 1";"9";"4.3.45";"YORK";"Maine, Blois, Poictiers, and Tours, are won away,"
"5294";"Henry VI Part 1";"9";"4.3.46";"YORK";"'Long all of Somerset and his delay."
"5295";"Henry VI Part 1";"9";;"YORK";"Exit, with his soldiers"
"5296";"Henry VI Part 1";"10";"4.3.47";"LUCY";"Thus, while the vulture of sedition"
"5297";"Henry VI Part 1";"10";"4.3.48";"LUCY";"Feeds in the bosom of such great commanders,"
"5298";"Henry VI Part 1";"10";"4.3.49";"LUCY";"Sleeping neglection doth betray to loss"
"5299";"Henry VI Part 1";"10";"4.3.50";"LUCY";"The conquest of our scarce cold conqueror,"
"5300";"Henry VI Part 1";"10";"4.3.51";"LUCY";"That ever living man of memory,"
"5301";"Henry VI Part 1";"10";"4.3.52";"LUCY";"Henry the Fifth: whiles they each other cross,"
"5302";"Henry VI Part 1";"10";"4.3.53";"LUCY";"Lives, honours, lands and all hurry to loss."
"5303";"Henry VI Part 1";"10";;"LUCY";"Exit"
"5304";"Henry VI Part 1";"10";;"LUCY";"SCENE IV. Other plains in Gascony."
"5305";"Henry VI Part 1";"10";;"LUCY";"Enter SOMERSET, with his army; a Captain of TALBOT's with him"
"5306";"Henry VI Part 1";"1";"4.4.1";"SOMERSET";"It is too late; I cannot send them now:"
"5307";"Henry VI Part 1";"1";"4.4.2";"SOMERSET";"This expedition was by York and Talbot"
"5308";"Henry VI Part 1";"1";"4.4.3";"SOMERSET";"Too rashly plotted: all our general force"
"5309";"Henry VI Part 1";"1";"4.4.4";"SOMERSET";"Might with a sally of the very town"
"5310";"Henry VI Part 1";"1";"4.4.5";"SOMERSET";"Be buckled with: the over-daring Talbot"
"5311";"Henry VI Part 1";"1";"4.4.6";"SOMERSET";"Hath sullied all his gloss of former honour"
"5312";"Henry VI Part 1";"1";"4.4.7";"SOMERSET";"By this unheedful, desperate, wild adventure:"
"5313";"Henry VI Part 1";"1";"4.4.8";"SOMERSET";"York set him on to fight and die in shame,"
"5314";"Henry VI Part 1";"1";"4.4.9";"SOMERSET";"That, Talbot dead, great York might bear the name."
"5315";"Henry VI Part 1";"2";"4.4.10";"Captain";"Here is Sir William Lucy, who with me"
"5316";"Henry VI Part 1";"2";"4.4.11";"Captain";"Set from our o'ermatch'd forces forth for aid."
"5317";"Henry VI Part 1";"2";;"Captain";"Enter Sir William LUCY"
"5318";"Henry VI Part 1";"3";"4.4.12";"SOMERSET";"How now, Sir William! whither were you sent?"
"5319";"Henry VI Part 1";"4";"4.4.13";"LUCY";"Whither, my lord? from bought and sold Lord Talbot;"
"5320";"Henry VI Part 1";"4";"4.4.14";"LUCY";"Who, ring'd about with bold adversity,"
"5321";"Henry VI Part 1";"4";"4.4.15";"LUCY";"Cries out for noble York and Somerset,"
"5322";"Henry VI Part 1";"4";"4.4.16";"LUCY";"To beat assailing death from his weak legions:"
"5323";"Henry VI Part 1";"4";"4.4.17";"LUCY";"And whiles the honourable captain there"
"5324";"Henry VI Part 1";"4";"4.4.18";"LUCY";"Drops bloody sweat from his war-wearied limbs,"
"5325";"Henry VI Part 1";"4";"4.4.19";"LUCY";"And, in advantage lingering, looks for rescue,"
"5326";"Henry VI Part 1";"4";"4.4.20";"LUCY";"You, his false hopes, the trust of England's honour,"
"5327";"Henry VI Part 1";"4";"4.4.21";"LUCY";"Keep off aloof with worthless emulation."
"5328";"Henry VI Part 1";"4";"4.4.22";"LUCY";"Let not your private discord keep away"
"5329";"Henry VI Part 1";"4";"4.4.23";"LUCY";"The levied succors that should lend him aid,"
"5330";"Henry VI Part 1";"4";"4.4.24";"LUCY";"While he, renowned noble gentleman,"
"5331";"Henry VI Part 1";"4";"4.4.25";"LUCY";"Yields up his life unto a world of odds:"
"5332";"Henry VI Part 1";"4";"4.4.26";"LUCY";"Orleans the Bastard, Charles, Burgundy,"
"5333";"Henry VI Part 1";"4";"4.4.27";"LUCY";"Alencon, Reignier, compass him about,"
"5334";"Henry VI Part 1";"4";"4.4.28";"LUCY";"And Talbot perisheth by your default."
"5335";"Henry VI Part 1";"5";"4.4.29";"SOMERSET";"York set him on; York should have sent him aid."
"5336";"Henry VI Part 1";"6";"4.4.30";"LUCY";"And York as fast upon your grace exclaims;"
"5337";"Henry VI Part 1";"6";"4.4.31";"LUCY";"Swearing that you withhold his levied host,"
"5338";"Henry VI Part 1";"6";"4.4.32";"LUCY";"Collected for this expedition."
"5339";"Henry VI Part 1";"7";"4.4.33";"SOMERSET";"York lies; he might have sent and had the horse;"
"5340";"Henry VI Part 1";"7";"4.4.34";"SOMERSET";"I owe him little duty, and less love;"
"5341";"Henry VI Part 1";"7";"4.4.35";"SOMERSET";"And take foul scorn to fawn on him by sending."
"5342";"Henry VI Part 1";"8";"4.4.36";"LUCY";"The fraud of England, not the force of France,"
"5343";"Henry VI Part 1";"8";"4.4.37";"LUCY";"Hath now entrapp'd the noble-minded Talbot:"
"5344";"Henry VI Part 1";"8";"4.4.38";"LUCY";"Never to England shall he bear his life;"
"5345";"Henry VI Part 1";"8";"4.4.39";"LUCY";"But dies, betray'd to fortune by your strife."
"5346";"Henry VI Part 1";"9";"4.4.40";"SOMERSET";"Come, go; I will dispatch the horsemen straight:"
"5347";"Henry VI Part 1";"9";"4.4.41";"SOMERSET";"Within six hours they will be at his aid."
"5348";"Henry VI Part 1";"10";"4.4.42";"LUCY";"Too late comes rescue: he is ta'en or slain;"
"5349";"Henry VI Part 1";"10";"4.4.43";"LUCY";"For fly he could not, if he would have fled;"
"5350";"Henry VI Part 1";"10";"4.4.44";"LUCY";"And fly would Talbot never, though he might."
"5351";"Henry VI Part 1";"11";"4.4.45";"SOMERSET";"If he be dead, brave Talbot, then adieu!"
"5352";"Henry VI Part 1";"12";"4.4.46";"LUCY";"His fame lives in the world, his shame in you."
"5353";"Henry VI Part 1";"12";;"LUCY";"Exeunt"
"5354";"Henry VI Part 1";"12";;"LUCY";"SCENE V. The English camp near Bourdeaux."
"5355";"Henry VI Part 1";"12";;"LUCY";"Enter TALBOT and JOHN his son"
"5356";"Henry VI Part 1";"1";"4.5.1";"TALBOT";"O young John Talbot! I did send for thee"
"5357";"Henry VI Part 1";"1";"4.5.2";"TALBOT";"To tutor thee in stratagems of war,"
"5358";"Henry VI Part 1";"1";"4.5.3";"TALBOT";"That Talbot's name might be in thee revived"
"5359";"Henry VI Part 1";"1";"4.5.4";"TALBOT";"When sapless age and weak unable limbs"
"5360";"Henry VI Part 1";"1";"4.5.5";"TALBOT";"Should bring thy father to his drooping chair."
"5361";"Henry VI Part 1";"1";"4.5.6";"TALBOT";"But, O malignant and ill-boding stars!"
"5362";"Henry VI Part 1";"1";"4.5.7";"TALBOT";"Now thou art come unto a feast of death,"
"5363";"Henry VI Part 1";"1";"4.5.8";"TALBOT";"A terrible and unavoided danger:"
"5364";"Henry VI Part 1";"1";"4.5.9";"TALBOT";"Therefore, dear boy, mount on my swiftest horse;"
"5365";"Henry VI Part 1";"1";"4.5.10";"TALBOT";"And I'll direct thee how thou shalt escape"
"5366";"Henry VI Part 1";"1";"4.5.11";"TALBOT";"By sudden flight: come, dally not, be gone."
"5367";"Henry VI Part 1";"2";"4.5.12";"JOHN TALBOT";"Is my name Talbot? and am I your son?"
"5368";"Henry VI Part 1";"2";"4.5.13";"JOHN TALBOT";"And shall I fly? O if you love my mother,"
"5369";"Henry VI Part 1";"2";"4.5.14";"JOHN TALBOT";"Dishonour not her honourable name,"
"5370";"Henry VI Part 1";"2";"4.5.15";"JOHN TALBOT";"To make a bastard and a slave of me!"
"5371";"Henry VI Part 1";"2";"4.5.16";"JOHN TALBOT";"The world will say, he is not Talbot's blood,"
"5372";"Henry VI Part 1";"2";"4.5.17";"JOHN TALBOT";"That basely fled when noble Talbot stood."
"5373";"Henry VI Part 1";"3";"4.5.18";"TALBOT";"Fly, to revenge my death, if I be slain."
"5374";"Henry VI Part 1";"4";"4.5.19";"JOHN TALBOT";"He that flies so will ne'er return again."
"5375";"Henry VI Part 1";"5";"4.5.20";"TALBOT";"If we both stay, we both are sure to die."
"5376";"Henry VI Part 1";"6";"4.5.21";"JOHN TALBOT";"Then let me stay; and, father, do you fly:"
"5377";"Henry VI Part 1";"6";"4.5.22";"JOHN TALBOT";"Your loss is great, so your regard should be;"
"5378";"Henry VI Part 1";"6";"4.5.23";"JOHN TALBOT";"My worth unknown, no loss is known in me."
"5379";"Henry VI Part 1";"6";"4.5.24";"JOHN TALBOT";"Upon my death the French can little boast;"
"5380";"Henry VI Part 1";"6";"4.5.25";"JOHN TALBOT";"In yours they will, in you all hopes are lost."
"5381";"Henry VI Part 1";"6";"4.5.26";"JOHN TALBOT";"Flight cannot stain the honour you have won;"
"5382";"Henry VI Part 1";"6";"4.5.27";"JOHN TALBOT";"But mine it will, that no exploit have done:"
"5383";"Henry VI Part 1";"6";"4.5.28";"JOHN TALBOT";"You fled for vantage, everyone will swear;"
"5384";"Henry VI Part 1";"6";"4.5.29";"JOHN TALBOT";"But, if I bow, they'll say it was for fear."
"5385";"Henry VI Part 1";"6";"4.5.30";"JOHN TALBOT";"There is no hope that ever I will stay,"
"5386";"Henry VI Part 1";"6";"4.5.31";"JOHN TALBOT";"If the first hour I shrink and run away."
"5387";"Henry VI Part 1";"6";"4.5.32";"JOHN TALBOT";"Here on my knee I beg mortality,"
"5388";"Henry VI Part 1";"6";"4.5.33";"JOHN TALBOT";"Rather than life preserved with infamy."
"5389";"Henry VI Part 1";"7";"4.5.34";"TALBOT";"Shall all thy mother's hopes lie in one tomb?"
"5390";"Henry VI Part 1";"8";"4.5.35";"JOHN TALBOT";"Ay, rather than I'll shame my mother's womb."
"5391";"Henry VI Part 1";"9";"4.5.36";"TALBOT";"Upon my blessing, I command thee go."
"5392";"Henry VI Part 1";"10";"4.5.37";"JOHN TALBOT";"To fight I will, but not to fly the foe."
"5393";"Henry VI Part 1";"11";"4.5.38";"TALBOT";"Part of thy father may be saved in thee."
"5394";"Henry VI Part 1";"12";"4.5.39";"JOHN TALBOT";"No part of him but will be shame in me."
"5395";"Henry VI Part 1";"13";"4.5.40";"TALBOT";"Thou never hadst renown, nor canst not lose it."
"5396";"Henry VI Part 1";"14";"4.5.41";"JOHN TALBOT";"Yes, your renowned name: shall flight abuse it?"
"5397";"Henry VI Part 1";"15";"4.5.42";"TALBOT";"Thy father's charge shall clear thee from that stain."
"5398";"Henry VI Part 1";"16";"4.5.43";"JOHN TALBOT";"You cannot witness for me, being slain."
"5399";"Henry VI Part 1";"16";"4.5.44";"JOHN TALBOT";"If death be so apparent, then both fly."
"5400";"Henry VI Part 1";"17";"4.5.45";"TALBOT";"And leave my followers here to fight and die?"
"5401";"Henry VI Part 1";"17";"4.5.46";"TALBOT";"My age was never tainted with such shame."
"5402";"Henry VI Part 1";"18";"4.5.47";"JOHN TALBOT";"And shall my youth be guilty of such blame?"
"5403";"Henry VI Part 1";"18";"4.5.48";"JOHN TALBOT";"No more can I be sever'd from your side,"
"5404";"Henry VI Part 1";"18";"4.5.49";"JOHN TALBOT";"Than can yourself yourself in twain divide:"
"5405";"Henry VI Part 1";"18";"4.5.50";"JOHN TALBOT";"Stay, go, do what you will, the like do I;"
"5406";"Henry VI Part 1";"18";"4.5.51";"JOHN TALBOT";"For live I will not, if my father die."
"5407";"Henry VI Part 1";"19";"4.5.52";"TALBOT";"Then here I take my leave of thee, fair son,"
"5408";"Henry VI Part 1";"19";"4.5.53";"TALBOT";"Born to eclipse thy life this afternoon."
"5409";"Henry VI Part 1";"19";"4.5.54";"TALBOT";"Come, side by side together live and die."
"5410";"Henry VI Part 1";"19";"4.5.55";"TALBOT";"And soul with soul from France to heaven fly."
"5411";"Henry VI Part 1";"19";;"TALBOT";"Exeunt"
"5412";"Henry VI Part 1";"19";;"TALBOT";"SCENE VI. A field of battle."
"5413";"Henry VI Part 1";"19";;"TALBOT";"Alarum: excursions, wherein JOHN TALBOT is hemmed about, and TALBOT rescues him"
"5414";"Henry VI Part 1";"1";"4.6.1";"TALBOT";"Saint George and victory! fight, soldiers, fight."
"5415";"Henry VI Part 1";"1";"4.6.2";"TALBOT";"The regent hath with Talbot broke his word"
"5416";"Henry VI Part 1";"1";"4.6.3";"TALBOT";"And left us to the rage of France his sword."
"5417";"Henry VI Part 1";"1";"4.6.4";"TALBOT";"Where is John Talbot? Pause, and take thy breath;"
"5418";"Henry VI Part 1";"1";"4.6.5";"TALBOT";"I gave thee life and rescued thee from death."
"5419";"Henry VI Part 1";"2";"4.6.6";"JOHN TALBOT";"O, twice my father, twice am I thy son!"
"5420";"Henry VI Part 1";"2";"4.6.7";"JOHN TALBOT";"The life thou gavest me first was lost and done,"
"5421";"Henry VI Part 1";"2";"4.6.8";"JOHN TALBOT";"Till with thy warlike sword, despite of late,"
"5422";"Henry VI Part 1";"2";"4.6.9";"JOHN TALBOT";"To my determined time thou gavest new date."
"5423";"Henry VI Part 1";"3";"4.6.10";"TALBOT";"When from the Dauphin's crest thy sword struck fire,"
"5424";"Henry VI Part 1";"3";"4.6.11";"TALBOT";"It warm'd thy father's heart with proud desire"
"5425";"Henry VI Part 1";"3";"4.6.12";"TALBOT";"Of bold-faced victory. Then leaden age,"
"5426";"Henry VI Part 1";"3";"4.6.13";"TALBOT";"Quicken'd with youthful spleen and warlike rage,"
"5427";"Henry VI Part 1";"3";"4.6.14";"TALBOT";"Beat down Alencon, Orleans, Burgundy,"
"5428";"Henry VI Part 1";"3";"4.6.15";"TALBOT";"And from the pride of Gallia rescued thee."
"5429";"Henry VI Part 1";"3";"4.6.16";"TALBOT";"The ireful bastard Orleans, that drew blood"
"5430";"Henry VI Part 1";"3";"4.6.17";"TALBOT";"From thee, my boy, and had the maidenhood"
"5431";"Henry VI Part 1";"3";"4.6.18";"TALBOT";"Of thy first fight, I soon encountered,"
"5432";"Henry VI Part 1";"3";"4.6.19";"TALBOT";"And interchanging blows I quickly shed"
"5433";"Henry VI Part 1";"3";"4.6.20";"TALBOT";"Some of his bastard blood; and in disgrace"
"5434";"Henry VI Part 1";"3";"4.6.21";"TALBOT";"Bespoke him thus; 'Contaminated, base"
"5435";"Henry VI Part 1";"3";"4.6.22";"TALBOT";"And misbegotten blood I spill of thine,"
"5436";"Henry VI Part 1";"3";"4.6.23";"TALBOT";"Mean and right poor, for that pure blood of mine"
"5437";"Henry VI Part 1";"3";"4.6.24";"TALBOT";"Which thou didst force from Talbot, my brave boy:'"
"5438";"Henry VI Part 1";"3";"4.6.25";"TALBOT";"Here, purposing the Bastard to destroy,"
"5439";"Henry VI Part 1";"3";"4.6.26";"TALBOT";"Came in strong rescue. Speak, thy father's care,"
